,Company,Website,Phone no
0,Techasoft Pvt. Ltd. - Software Development Company,https://www.techasoft.com/,09986056909
1,Muraai Information Technologies Pvt Ltd,http://www.muraai.com/,09880136000
2,Object IT Solutions INDIA Pvt. Ltd,http://www.objectit.com/,
3,Enstrapp IT Solutions Private Limited,http://www.enstrapp.com/,08041205480
4,Mobiotics IT Solution Pvt Ltd,http://www.mobiotics.com/,09620209869
5,Hiver,https://hiverhq.com/,08022587595
6,Pixel Mind IT Solutions,https://pixelmindit.com/,
7,Technoforte Software Pvt Ltd,http://www.technoforte.co.in/,08022589661
8,JK Tech Bangalore Karnataka,https://jktech.com/,08046724000
9,Whatfix Innovate,https://whatfix.com/,
10,Crayon Software Experts India Private Limited,http://www.crayon.com/en-IN/about-us/,08042679100
11,Reckonsys Tech Labs Pvt Ltd,https://www.reckonsys.com/,08047493499
12,Tarnea Technology Solutions Pvt. Ltd.,https://www.tarnea.com/,09164024999
13,Nous Infosystems,https://www.nousinfosystems.com/,08042603000
14,Immerpact Private Limited,https://www.immerpact.com/,08248962392
15,Moksha Digital Software Pvt. Ltd.,http://www.mokshadigital.com/,08041101208
16,"Terralogic Software Solutions Pvt. Ltd. , HSR Layout, Bangalore",https://terralogic.com/,
17,Vince Software India Pvt Ltd,https://vincesoftware.com/,95101321
18,Embright Infotech Private Limited - VR Company Bangalore,http://www.embrightinfotech.com/,08792975982
19,Website development company Bangalore | ReactJS | NodeJS | Django | VueJS,https://www.inkoop.io/?utm_source=gmaps&utm_medium=link&utm_campaign=social,
20,Software Solutions, , 
21,Zool Tech Solutions Pvt Ltd,http://www.zool.in/,09019252065
22,Alamance IT Solutions LLP,http://alamanceinc.com/,09108443850
23,Spigot Software Private Limited,http://www.spigotsoftware.in/,09035021730
24,US Software Group,http://ussoftwaregroup.com/,
25,Techcushy Software Solutions Pvt Ltd,http://techcushy.com/,08041616001
26,Trisys IT Services Pvt Ltd,http://trisysit.com/,09341128899
27,Adroit Global Solutions,http://adroitcorp.co.in/,08041258988
28,Brain Crowd Software Private Limited,http://www.brain-crowd.com/,07282894545
29,CresTech Software Systems Pvt. Ltd.,http://www.crestechglobal.com/,08826666755
30,Pcloudy.com,https://www.pcloudy.com/,08022582242
31,Stixis Technologies Private Limited,http://www.stixis.com/,
32,Best Mobile App Development Company in HSR, , 
33,ReactiveWorks IT Solutions Pvt. Ltd,http://www.reactiveworks.in/,
34,Capillary Technologies Bengaluru,https://www.capillarytech.com/,08068404468
35,Think N Solutions Software Pvt Ltd,http://www.thinknsolutions.com/,08042818900
36,Exalca Technologies Pvt Ltd,http://www.exalca.com/,08041115686
37,Moolya Cafe | HSR Layout,https://moolya.com/,
38,Tracxn Technologies Limited,http://tracxn.com/,07760609666
39,AdaptNXT Technology Solutions Pvt Ltd (PointNXT),https://adaptnxt.com/,08310319838
40,IndiZeal Software Solutions,http://indizeal.in/,07975223449
41,Software Solutions, , 
42,Fibonalabs: UX Design Studio | Software Product Development Company,https://fibonalabs.com/,03802069779
43,Cybrilla,http://www.cybrilla.com/,09035009074
44,VersionX Innovations,https://www.versionx.in/,07353026266
45,Factana Computing Pvt. Ltd - Industrial Software Provider,http://www.fogwing.io/,08043007165
46,Spaaz Infotech (p) ltd - Software | Website | Mobile Application development company in bangalore,https://www.spaaztech.com/,08072971144
47,Cybrow IT Solutions - India,http://cybrow.com/,08893518333
48,Avekshaa Technologies Pvt Ltd,http://www.avekshaa.com/,
49,S Technologies PVT LTD,#,08040682288
50,TECHGEN,https://itechgen.org/,07219033922
51,Stridefuture Technologies,https://www.stridefuture.com/,08929940177
52,Chimera Technologies Pvt. Ltd,https://www.chimeratechnologies.com/,09205225525
53,CEDRON SOFTWARE SOLUTIONS PVT LTD,http://cedronglobal.com/,08069990000
54,ESM Square Technologies Pvt Ltd,https://esquaredhr.com/,08035216856
55,Srawalgan Technologies,http://srawalgan.com/,08088344719
56,Softwareone India Private Limited,http://www.softwareone.com/,01243044099
57,ATDXT Private Limited,https://www.atdxt.com/,
58,Niyata Infotech Private Limited,http://niyatainfotech.com/,08041681921
59,SimpliContract Technologies Inc. (India Center),https://simplicontract.com/,
60,Town Contacts Technologies Pvt Ltd,https://automatically.live/,
61,Meritum Solutions,#,07757919401
